{
  "schemaVersion": 1,
  "sourceId": "presentation.audio.v11",
  "music": [
    {
      "id": "music.opening_founder_arrival",
      "displayName": "Opening / Founder Arrival",
      "assetPath": "/Game/Audio/Music/DA_OpeningFounderArrival",
      "recipe": {
        "palette": [
          "restrained harmonic pulse",
          "human strings"
        ],
        "playback": "one_shot_to_exploration",
        "purpose": "introduces Founder and first city"
      }
    },
    {
      "id": "music.synara_city_day",
      "displayName": "Synara City Day",
      "assetPath": "/Game/Audio/Music/DA_SynaraCityDay",
      "recipe": {
        "palette": [
          "glassy percussion",
          "subtle computation"
        ],
        "playback": "seamless_loop",
        "purpose": "calm Synara civic operation"
      }
    },
    {
      "id": "music.synara_tension",
      "displayName": "Synara Tension",
      "assetPath": "/Game/Audio/Music/DA_SynaraTension",
      "recipe": {
        "palette": [
          "controlled machine pulse",
          "low string pressure"
        ],
        "playback": "adaptive_loop",
        "purpose": "Dependency and city tension"
      }
    },
    {
      "id": "music.forgeweave_region",
      "displayName": "Forgeweave Region",
      "assetPath": "/Game/Audio/Music/DA_ForgeweaveRegion",
      "recipe": {
        "palette": [
          "heavy percussion",
          "deep metal resonance"
        ],
        "playback": "seamless_loop",
        "purpose": "Ironheart regional identity"
      }
    },
    {
      "id": "music.eden_basin",
      "displayName": "Eden Basin",
      "assetPath": "/Game/Audio/Music/DA_EdenBasin",
      "recipe": {
        "palette": [
          "water rhythm",
          "wood resonance",
          "living texture"
        ],
        "playback": "seamless_loop",
        "purpose": "Eden ecological operation"
      }
    },
    {
      "id": "music.frontier_combat",
      "displayName": "Frontier Combat",
      "assetPath": "/Game/Audio/Music/DA_FrontierCombat",
      "recipe": {
        "palette": [
          "tactical percussion",
          "low brass pulse"
        ],
        "playback": "adaptive_loop",
        "purpose": "frontier systemic combat"
      }
    },
    {
      "id": "music.iron_veil",
      "displayName": "Iron Veil",
      "assetPath": "/Game/Audio/Music/DA_IronVeil",
      "recipe": {
        "palette": [
          "industrial ostinato",
          "pressure vent rhythm"
        ],
        "playback": "adaptive_loop",
        "purpose": "Operation Iron Veil"
      }
    },
    {
      "id": "music.daxton_grand_forge",
      "displayName": "Daxton / Grand Forge",
      "assetPath": "/Game/Audio/Music/DA_DaxtonGrandForge",
      "recipe": {
        "palette": [
          "furnace roar rhythm",
          "heavy mechanical percussion"
        ],
        "playback": "adaptive_boss_phases",
        "purpose": "Daxton encounter phases"
      }
    },
    {
      "id": "music.ascension_convergence",
      "displayName": "Ascension / Convergence",
      "assetPath": "/Game/Audio/Music/DA_AscensionConvergence",
      "recipe": {
        "palette": [
          "precision rhythm",
          "heavy resonance",
          "ancient harmonic"
        ],
        "playback": "one_shot_sequence",
        "purpose": "Forgeweave authority transfer"
      }
    }
  ],
  "ambient": [
    {
      "id": "ambient.synara_civic",
      "displayName": "Synara civic",
      "assetPath": "/Game/Audio/Ambient/DA_SynaraCivic",
      "recipe": {
        "layers": [
          "occupied civic murmur",
          "autonomous service lanes",
          "restrained data pulses"
        ],
        "spatialized": true,
        "loopSeconds": 90
      }
    },
    {
      "id": "ambient.synara_industrial",
      "displayName": "Synara industrial",
      "assetPath": "/Game/Audio/Ambient/DA_SynaraIndustrial",
      "recipe": {
        "layers": [
          "robotic cells",
          "precise actuators",
          "spatial drone motion"
        ],
        "spatialized": true,
        "loopSeconds": 85
      }
    },
    {
      "id": "ambient.synara_night",
      "displayName": "Synara night",
      "assetPath": "/Game/Audio/Ambient/DA_SynaraNight",
      "recipe": {
        "layers": [
          "distant transit",
          "quiet machine pulses",
          "inhabited windows"
        ],
        "spatialized": true,
        "loopSeconds": 100
      }
    },
    {
      "id": "ambient.forgeweave_industrial",
      "displayName": "Forgeweave industrial",
      "assetPath": "/Game/Audio/Ambient/DA_ForgeweaveIndustrial",
      "recipe": {
        "layers": [
          "hammering",
          "rail clanks",
          "pressure vents"
        ],
        "spatialized": true,
        "loopSeconds": 80
      }
    },
    {
      "id": "ambient.forgeweave_worker_district",
      "displayName": "Forgeweave worker district",
      "assetPath": "/Game/Audio/Ambient/DA_ForgeweaveWorkerDistrict",
      "recipe": {
        "layers": [
          "worker voices",
          "freight movement",
          "maintenance roads"
        ],
        "spatialized": true,
        "loopSeconds": 95
      }
    },
    {
      "id": "ambient.forgeweave_grand_forge",
      "displayName": "Forgeweave Grand Forge",
      "assetPath": "/Game/Audio/Ambient/DA_ForgeweaveGrandForge",
      "recipe": {
        "layers": [
          "furnace roar",
          "chain drive",
          "vertical machinery"
        ],
        "spatialized": true,
        "loopSeconds": 75
      }
    },
    {
      "id": "ambient.eden_wetland",
      "displayName": "Eden wetland",
      "assetPath": "/Game/Audio/Ambient/DA_EdenWetland",
      "recipe": {
        "layers": [
          "water",
          "insects",
          "soft wind"
        ],
        "spatialized": true,
        "loopSeconds": 110
      }
    },
    {
      "id": "ambient.eden_settlement",
      "displayName": "Eden settlement",
      "assetPath": "/Game/Audio/Ambient/DA_EdenSettlement",
      "recipe": {
        "layers": [
          "wood resonance",
          "plant movement",
          "human activity"
        ],
        "spatialized": true,
        "loopSeconds": 105
      }
    },
    {
      "id": "ambient.frontier_wilderness",
      "displayName": "Frontier wilderness",
      "assetPath": "/Game/Audio/Ambient/DA_FrontierWilderness",
      "recipe": {
        "layers": [
          "wind",
          "distant fauna",
          "weather movement"
        ],
        "spatialized": true,
        "loopSeconds": 120
      }
    },
    {
      "id": "ambient.neutral_settlement",
      "displayName": "neutral settlement",
      "assetPath": "/Game/Audio/Ambient/DA_NeutralSettlement",
      "recipe": {
        "layers": [
          "city crowd",
          "local utilities",
          "street activity"
        ],
        "spatialized": true,
        "loopSeconds": 90
      }
    },
    {
      "id": "ambient.axiom_tunnel",
      "displayName": "Axiom tunnel",
      "assetPath": "/Game/Audio/Ambient/DA_AxiomTunnel",
      "recipe": {
        "layers": [
          "stone resonance",
          "remote machine lattice",
          "sub-bass air"
        ],
        "spatialized": true,
        "loopSeconds": 80
      }
    },
    {
      "id": "ambient.post_ascension_capital",
      "displayName": "post-Ascension capital",
      "assetPath": "/Game/Audio/Ambient/DA_PostAscensionCapital",
      "recipe": {
        "layers": [
          "Synara computation",
          "Forgeweave annex machinery",
          "Relic resonance"
        ],
        "spatialized": true,
        "loopSeconds": 100
      }
    }
  ],
  "sfx": [
    {
      "id": "sfx.ui.confirm",
      "family": "ui",
      "assetPath": "/Game/Audio/SFX/Ui_Confirm/DA_SFX_Ui_Confirm",
      "recipe": {
        "transient": "short harmonic confirmation",
        "palette": "glassy tick",
        "event": "positive interface action",
        "variationLayers": 0
      }
    },
    {
      "id": "sfx.ui.cancel",
      "family": "ui",
      "assetPath": "/Game/Audio/SFX/Ui_Cancel/DA_SFX_Ui_Cancel",
      "recipe": {
        "transient": "soft descending rejection",
        "palette": "muted click",
        "event": "non-destructive cancel",
        "variationLayers": 0
      }
    },
    {
      "id": "sfx.ui.warning",
      "family": "ui",
      "assetPath": "/Game/Audio/SFX/Ui_Warning/DA_SFX_Ui_Warning",
      "recipe": {
        "transient": "two-stage caution pulse",
        "palette": "restrained alarm",
        "event": "actionable warning",
        "variationLayers": 0
      }
    },
    {
      "id": "sfx.ui.focus",
      "family": "ui",
      "assetPath": "/Game/Audio/SFX/Ui_Focus/DA_SFX_Ui_Focus",
      "recipe": {
        "transient": "single tactile index",
        "palette": "quiet interface tap",
        "event": "focus movement",
        "variationLayers": 0
      }
    },
    {
      "id": "sfx.ui.notification",
      "family": "ui",
      "assetPath": "/Game/Audio/SFX/Ui_Notification/DA_SFX_Ui_Notification",
      "recipe": {
        "transient": "layered civic chime",
        "palette": "short harmonic tone",
        "event": "new information",
        "variationLayers": 0
      }
    },
    {
      "id": "sfx.card.draw",
      "family": "card",
      "assetPath": "/Game/Audio/SFX/Card_Draw/DA_SFX_Card_Draw",
      "recipe": {
        "transient": "paper-composite slide",
        "palette": "light mechanism",
        "event": "card enters hand",
        "variationLayers": 0
      }
    },
    {
      "id": "sfx.card.inspect",
      "family": "card",
      "assetPath": "/Game/Audio/SFX/Card_Inspect/DA_SFX_Card_Inspect",
      "recipe": {
        "transient": "pedestal latch",
        "palette": "soft harmonic lift",
        "event": "3D inspect opens",
        "variationLayers": 0
      }
    },
    {
      "id": "sfx.card.place",
      "family": "card",
      "assetPath": "/Game/Audio/SFX/Card_Place/DA_SFX_Card_Place",